{
  "$schema": "./schemas/before-or-after.schema.json",
  "game": "before-or-after",
  "version": 1,
  "displayName": "Before Or After",
  "roundsPerSession": 15,
  "sessions": [
    {
      "id": "boa-session-001",
      "title": "Before Or After Pack 001",
      "theme": "Bible event order",
      "rounds": [
        {
          "id": "boa-r001",
          "leftEvent": "Creation",
          "rightEvent": "Fall in Eden",
          "earlierEvent": "left",
          "explanation": "Creation comes earlier in the biblical sequence than Fall in Eden.",
          "theme": "Bible event order",
          "difficulty": "easy",
          "teachingNote": "Creation comes earlier in the biblical sequence than Fall in Eden."
        },
        {
          "id": "boa-r002",
          "leftEvent": "Cain kills Abel",
          "rightEvent": "Fall in Eden",
          "earlierEvent": "right",
          "explanation": "Fall in Eden comes earlier in the biblical sequence than Cain kills Abel.",
          "theme": "Bible event order",
          "difficulty": "medium",
          "teachingNote": "Fall in Eden comes earlier in the biblical sequence than Cain kills Abel."
        },
        {
          "id": "boa-r003",
          "leftEvent": "Cain kills Abel",
          "rightEvent": "Noah builds the ark",
          "earlierEvent": "left",
          "explanation": "Cain kills Abel comes earlier in the biblical sequence than Noah builds the ark.",
          "theme": "Bible event order",
          "difficulty": "hard",
          "teachingNote": "Cain kills Abel comes earlier in the biblical sequence than Noah builds the ark."
        },
        {
          "id": "boa-r004",
          "leftEvent": "Flood covers the earth",
          "rightEvent": "Noah builds the ark",
          "earlierEvent": "right",
          "explanation": "Noah builds the ark comes earlier in the biblical sequence than Flood covers the earth.",
          "theme": "Bible event order",
          "difficulty": "easy",
          "teachingNote": "Noah builds the ark comes earlier in the biblical sequence than Flood covers the earth."
        },
        {
          "id": "boa-r005",
          "leftEvent": "Flood covers the earth",
          "rightEvent": "Tower of Babel",
          "earlierEvent": "left",
          "explanation": "Flood covers the earth comes earlier in the biblical sequence than Tower of Babel.",
          "theme": "Bible event order",
          "difficulty": "medium",
          "teachingNote": "Flood covers the earth comes earlier in the biblical sequence than Tower of Babel."
        },
        {
          "id": "boa-r006",
          "leftEvent": "Abram leaves Haran",
          "rightEvent": "Tower of Babel",
          "earlierEvent": "right",
          "explanation": "Tower of Babel comes earlier in the biblical sequence than Abram leaves Haran.",
          "theme": "Bible event order",
          "difficulty": "hard",
          "teachingNote": "Tower of Babel comes earlier in the biblical sequence than Abram leaves Haran."
        },
        {
          "id": "boa-r007",
          "leftEvent": "Abram leaves Haran",
          "rightEvent": "Isaac is born",
          "earlierEvent": "left",
          "explanation": "Abram leaves Haran comes earlier in the biblical sequence than Isaac is born.",
          "theme": "Bible event order",
          "difficulty": "easy",
          "teachingNote": "Abram leaves Haran comes earlier in the biblical sequence than Isaac is born."
        },
        {
          "id": "boa-r008",
          "leftEvent": "Jacob receives the blessing",
          "rightEvent": "Isaac is born",
          "earlierEvent": "right",
          "explanation": "Isaac is born comes earlier in the biblical sequence than Jacob receives the blessing.",
          "theme": "Bible event order",
          "difficulty": "medium",
          "teachingNote": "Isaac is born comes earlier in the biblical sequence than Jacob receives the blessing."
        },
        {
          "id": "boa-r009",
          "leftEvent": "Jacob receives the blessing",
          "rightEvent": "Joseph is sold by his brothers",
          "earlierEvent": "left",
          "explanation": "Jacob receives the blessing comes earlier in the biblical sequence than Joseph is sold by his brothers.",
          "theme": "Bible event order",
          "difficulty": "hard",
          "teachingNote": "Jacob receives the blessing comes earlier in the biblical sequence than Joseph is sold by his brothers."
        },
        {
          "id": "boa-r010",
          "leftEvent": "Israel moves to Egypt",
          "rightEvent": "Joseph is sold by his brothers",
          "earlierEvent": "right",
          "explanation": "Joseph is sold by his brothers comes earlier in the biblical sequence than Israel moves to Egypt.",
          "theme": "Bible event order",
          "difficulty": "easy",
          "teachingNote": "Joseph is sold by his brothers comes earlier in the biblical sequence than Israel moves to Egypt."
        },
        {
          "id": "boa-r011",
          "leftEvent": "Israel moves to Egypt",
          "rightEvent": "Moses is born",
          "earlierEvent": "left",
          "explanation": "Israel moves to Egypt comes earlier in the biblical sequence than Moses is born.",
          "theme": "Bible event order",
          "difficulty": "medium",
          "teachingNote": "Israel moves to Egypt comes earlier in the biblical sequence than Moses is born."
        },
        {
          "id": "boa-r012",
          "leftEvent": "Moses sees the burning bush",
          "rightEvent": "Moses is born",
          "earlierEvent": "right",
          "explanation": "Moses is born comes earlier in the biblical sequence than Moses sees the burning bush.",
          "theme": "Bible event order",
          "difficulty": "hard",
          "teachingNote": "Moses is born comes earlier in the biblical sequence than Moses sees the burning bush."
        },
        {
          "id": "boa-r013",
          "leftEvent": "Moses sees the burning bush",
          "rightEvent": "Plagues strike Egypt",
          "earlierEvent": "left",
          "explanation": "Moses sees the burning bush comes earlier in the biblical sequence than Plagues strike Egypt.",
          "theme": "Bible event order",
          "difficulty": "easy",
          "teachingNote": "Moses sees the burning bush comes earlier in the biblical sequence than Plagues strike Egypt."
        },
        {
          "id": "boa-r014",
          "leftEvent": "The Passover night",
          "rightEvent": "Plagues strike Egypt",
          "earlierEvent": "right",
          "explanation": "Plagues strike Egypt comes earlier in the biblical sequence than The Passover night.",
          "theme": "Bible event order",
          "difficulty": "medium",
          "teachingNote": "Plagues strike Egypt comes earlier in the biblical sequence than The Passover night."
        },
        {
          "id": "boa-r015",
          "leftEvent": "The Passover night",
          "rightEvent": "The Red Sea crossing",
          "earlierEvent": "left",
          "explanation": "The Passover night comes earlier in the biblical sequence than The Red Sea crossing.",
          "theme": "Bible event order",
          "difficulty": "hard",
          "teachingNote": "The Passover night comes earlier in the biblical sequence than The Red Sea crossing."
        }
      ]
    },
    {
      "id": "boa-session-002",
      "title": "Before Or After Pack 002",
      "theme": "Bible event order",
      "rounds": [
        {
          "id": "boa-r016",
          "leftEvent": "The law is given at Sinai",
          "rightEvent": "The Red Sea crossing",
          "earlierEvent": "right",
          "explanation": "The Red Sea crossing comes earlier in the biblical sequence than The law is given at Sinai.",
          "theme": "Bible event order",
          "difficulty": "easy",
          "teachingNote": "The Red Sea crossing comes earlier in the biblical sequence than The law is given at Sinai."
        },
        {
          "id": "boa-r017",
          "leftEvent": "The law is given at Sinai",
          "rightEvent": "The tabernacle is built",
          "earlierEvent": "left",
          "explanation": "The law is given at Sinai comes earlier in the biblical sequence than The tabernacle is built.",
          "theme": "Bible event order",
          "difficulty": "medium",
          "teachingNote": "The law is given at Sinai comes earlier in the biblical sequence than The tabernacle is built."
        },
        {
          "id": "boa-r018",
          "leftEvent": "The spies enter Canaan",
          "rightEvent": "The tabernacle is built",
          "earlierEvent": "right",
          "explanation": "The tabernacle is built comes earlier in the biblical sequence than The spies enter Canaan.",
          "theme": "Bible event order",
          "difficulty": "hard",
          "teachingNote": "The tabernacle is built comes earlier in the biblical sequence than The spies enter Canaan."
        },
        {
          "id": "boa-r019",
          "leftEvent": "The spies enter Canaan",
          "rightEvent": "Joshua leads Israel",
          "earlierEvent": "left",
          "explanation": "The spies enter Canaan comes earlier in the biblical sequence than Joshua leads Israel.",
          "theme": "Bible event order",
          "difficulty": "easy",
          "teachingNote": "The spies enter Canaan comes earlier in the biblical sequence than Joshua leads Israel."
        },
        {
          "id": "boa-r020",
          "leftEvent": "The Jordan River crossing",
          "rightEvent": "Joshua leads Israel",
          "earlierEvent": "right",
          "explanation": "Joshua leads Israel comes earlier in the biblical sequence than The Jordan River crossing.",
          "theme": "Bible event order",
          "difficulty": "medium",